,Business Address,Latitude,Longitude,Lifeline,Business Name,Business Category
0,"7575 Metropolitan Drive # 103, San Diego",32.7767669,-117.1566058,1,Coastal Commission,local_government_office
1,"1010 2nd Avenue #666, San Diego",32.7162522,-117.1633619,1,San Diego Collection Division,local_government_office
2,"880 Front Street Suite 4236, San Diego",32.7143258,-117.1653526,1,Senator Dianne Feinstein,local_government_office
3,"500 3rd Avenue, Chula Vista",32.6328632,-117.0772936,1,Superior Court South County Division,"courthouse, local_government_office"
4,"8505 Aero Drive, San Diego",32.8091099,-117.144154,1,Social Security Administration,local_government_office
5,"401 B Street #800, San Diego",32.717374,-117.160633,1,San Diego Association of Governments (SANDAG),local_government_office
6,"3375 Camino del Rio South, San Diego",32.7761723,-117.1206559,1,San Diego Community College District,"local_government_office, university"
7,"750 B Street # 300, San Diego",32.7180606,-117.1579595,1,Court of Appeal Clerk Office,local_government_office
8,"1600 Pacific Highway, San Diego",32.7219437,-117.1719177,1,San Diego Birth Certificates,local_government_office
9,"5510 Overland Avenue, San Diego",32.8334823,-117.1296858,1,San Diego County Planning & Development Services,local_government_office
10,"3165 Pacific Highway, San Diego",32.7353163,-117.1772172,1,Port of San Diego,"tourist_attraction, local_government_office"
11,"3851 Rosecrans Street, San Diego",32.7526794,-117.2019373,1,Health and Human Services Agency,"local_government_office, health"
12,"5201 Ruffin Court # N, San Diego",32.82980189999999,-117.1252873,1,San Diego County Trade Dev,local_government_office
13,"5755 Oberlin Drive #301, San Diego",32.8925852,-117.1942001,1,"Express Travel Services,Inc - Passport & Visa Agency San Diego","travel_agency, local_government_office"
14,"7676 Hazard Center Drive 5th Floor, San Diego",32.7714105,-117.1567095,1,The Law Office of Bradley R. Corbett,"lawyer, local_government_office"
15,"3851 Rosecrans Street, San Diego",32.7526947,-117.2019334,1,San Diego County Tuberculosis,local_government_office
16,"3111 Camino Del Rio North # 400, San Diego",32.7747538,-117.1274727,1,Milvets Systems Technology Inc,local_government_office
17,"7961 University Avenue, La Mesa",32.7642933,-117.0264177,1,Social Security Office,local_government_office
18,"2525 Camino del Rio South Ste. 325, San Diego",32.76779130000001,-117.137551,1,Passport Health San Diego (Camino Del Rio) Travel Clinic,"local_government_office, health"
19,"402 West Broadway, San Diego",32.7162107,-117.1669839,1,AJL Video,local_government_office
20,"8880 Rio San Diego Drive #800, San Diego",32.7767083,-117.1388284,1,Regal Group CPA,"accounting, finance, local_government_office"
21,"7575 Metropolitan Drive #211, San Diego",32.7767439,-117.1567139,1,Health Service Department,"local_government_office, health"
22,"1350 Front Street # 3005, San Diego",32.7194187,-117.1650783,1,Administrative Hearings Office,local_government_office
23,"9225 Clairemont Mesa Boulevard, San Diego",32.830882,-117.12925,1,San Diego Deed & Document Record,local_government_office
24,"4510 Executive Drive, San Diego",32.87615829999999,-117.2108647,1,US Food & Drug Administration,"local_government_office, health"
25,"250 East Main Street #1, El Cajon",32.79679969999999,-116.9589774,1,Superior Court East County Division,"courthouse, local_government_office"
26,"1200 Third Avenue, San Diego",32.7181792,-117.1625402,1,San Diego Special Events,local_government_office
27,"6111 Business Center Court, San Diego",32.5688786,-117.0031524,1,San Ysidro DMV,local_government_office
28,"2851 Meadow Lark Drive, San Diego",32.7954793,-117.1542689,1,Juvenile Court,"courthouse, local_government_office"
29,"16935 West Bernardo Drive # 103, San Diego",33.022176,-117.081406,1,Technicolor USA Inc,local_government_office
30,"1450 Graves Avenue, El Cajon",32.8173386,-116.9599063,1,California Department of Motor Vehicles,local_government_office
31,"10920 Via Frontera # 300, San Diego",33.0140256,-117.0944738,1,Department of General Services,local_government_office
32,"5510 Overland Avenue #270, San Diego",32.8334641,-117.1296759,1,Department of Public Works - Survey Records,local_government_office
33,"1 Civic Center Drive, San Marcos",33.1404469,-117.1609222,1,San Marcos City Hall,"city_hall, local_government_office"
34,"367 North Magnolia Avenue #101, El Cajon",32.7985196,-116.9605032,1,East Region Public Health,"local_government_office, health"
35,"Symphony Tower, 750 B Street #1600, San Diego",32.71799369999999,-117.1578011,1,US Housing & Urban Dev Department,local_government_office
36,"5202 University Avenue, San Diego",32.749553,-117.083318,1,San Diego County Public Health,"local_government_office, health"
37,"5530 Overland Avenue, San Diego",32.8347943,-117.1294514,1,San Diego County Human Resources,local_government_office
38,"1151 25th Street, San Diego",32.57540129999999,-117.0780751,1,Coronado Terrace Apartments,local_government_office
39,"401 West A Street #1300, San Diego",32.71829400000001,-117.1669316,1,County Employees Retire System,local_government_office
40,"1600 Pacific Highway # 402, San Diego",32.72194869999999,-117.1721077,1,San Diego Board-Assmts Appeals,local_government_office
41,"330 West Broadway # 8, San Diego",32.7161675,-117.1660509,1,San Diego Case Issuance,local_government_office
42,"4050 Taylor Street, San Diego",32.7569475,-117.1993557,1,California Department of Transportation District 11,local_government_office
43,"2801 Meadow Lark Drive, San Diego",32.7941465,-117.1539666,1,San Diego Juvenile Hall,"courthouse, local_government_office"
44,"501 West Broadway # 1260, San Diego",32.715111,-117.16777,1,Noon & Associates,"lawyer, local_government_office"
45,"8965 Balboa Avenue, San Diego",32.8210577,-117.1356309,1,San Diego County Guardianship,local_government_office
46,"1 Civic Center Drive, San Marcos",33.14065829999999,-117.1608995,1,San Marcos Business License,local_government_office
47,"9621 Ridgehaven Court, San Diego",32.818928,-117.121398,1,San Diego County Sheriff's Department Headquarters,"police, local_government_office"
48,"635 Highway 101, Solana Beach",32.983616,-117.2701208,1,Solana Beach City Clerk,local_government_office
49,"Trolley Plaza, San Diego",32.7055909,-117.1534308,1,Mills Building | MTS Center,local_government_office
50,"6401 Linda Vista Road, San Diego",32.769582,-117.1796886,1,Superintendent of Schools,local_government_office
51,"5902 Kearny Villa Road, San Diego",32.83960549999999,-117.1304566,1,California Highway Patrol,local_government_office
52,"1157 West Mission Avenue, Escondido",33.12401359999999,-117.1023327,1,United States Postal Service,"post_office, finance, local_government_office"
53,"5580 Overland Avenue, San Diego",32.8347007,-117.1333281,1,San Diego County Office of Emergency Services,local_government_office
54,"2260 Jimmy Durante Boulevard, Del Mar",32.9739692,-117.2636209,1,"State of California, 22nd District Agricultural Association",local_government_office
55,"324 Horton Plaza, San Diego",32.7137722,-117.1624218,1,Fire Engine Dogs,fire_station
56,Carlsbad,33.1055753,-117.3054058,1,Carlsbad Fire Station 4,fire_station
57,"635 Highway 101, Solana Beach",32.9835749,-117.2702294,1,Solana Beach Fire Department,fire_station
58,"14145 California 94, Jamul",32.7053015,-116.8682384,1,San Diego County Fire Station 36,fire_station
59,"2850 Via Orange Way, Spring Valley",32.73016500000001,-116.969798,1,San Miguel Fire District Station 15,fire_station
60,"421 North Midway Drive, Escondido",33.1382225,-117.0526065,1,Escondido Fire Department Station 2,fire_station
61,"7201 Rancho Santa Fe Road, Carlsbad",33.0944943,-117.2258216,1,City of Carlsbad Fire Station 6,fire_station
62,"4900 Bonita Road, Bonita",32.665544,-117.0232361,1,Bonita-Sunnyside Fire Protection District,fire_station
63,"809 Nautilus Street, La Jolla",32.8326844,-117.2721421,1,San Diego Fire Department Station 13,fire_station
64,"266 East Oneida Street, Chula Vista",32.6147105,-117.0444627,1,Chula Vista Fire Department Station 9,fire_station
65,"3974 Goldfinch Street, San Diego",32.74948800000001,-117.1716759,1,San Diego Fire-Rescue Department Station 8,fire_station
66,"198 West San Ysidro Boulevard, San Diego",32.5531998,-117.0474904,1,San Diego Fire-Rescue Department Station 29,fire_station
67,"3698 Pacific Highway, San Diego",32.73590410000001,-117.1899745,1,Airport Fire Station,fire_station
68,"3255 Helix Street, Spring Valley",32.7416902,-116.9982818,1,San Miguel Fire District Station 14,fire_station
69,"4206 Chamoune Avenue, San Diego",32.7534105,-117.0967309,1,San Diego Fire-Rescue Department Station 17,fire_station
70,"1972 Chicago Street, San Diego",32.78191109999999,-117.2063327,1,San Diego Fire-Rescue Department Station 25,fire_station
71,"4914 Carroll Canyon Road, San Diego",32.8901792,-117.2006719,1,San Diego Fire-Rescue Department Station 41,fire_station
72,"5855 Chateau Drive, San Diego",32.8222028,-117.1746022,1,San Diego Fire-Rescue Department Station 36,fire_station
73,"200 Civic Center Way, El Cajon",32.7964872,-116.9598502,1,El Cajon Treasurer Administration,fire_station
74,"905 Gillespie Drive, Spring Valley",32.7097738,-117.0069668,1,San Miguel Fire District Station 16,fire_station
75,"6565 Cowles Mountain Boulevard, San Diego",32.80254,-117.0251589,1,San Diego Fire-Rescue Department Station 34,fire_station
76,"107 Albatross Place, El Cajon",32.8021797,-116.8694596,1,Little Fire Truck Co,fire_station
77,"2140 Dehesa Road, El Cajon",32.7880728,-116.9048269,1,San Miguel Fire District Station 23,fire_station
78,"1180 Woods Drive, Chula Vista",32.6457406,-116.9456555,1,Chula Vista Fire Department Station 8,fire_station
79,"2265 Coronado Avenue, San Diego",32.5761707,-117.0849415,1,San Diego Fire-Rescue Department Station 30,fire_station
80,"1640 Santa Venetia Street, Chula Vista",32.6212176,-116.984849,1,Chula Vista Fire Department Station 7,fire_station
81,"1055 Catalina Boulevard, San Diego",32.7255794,-117.2444416,1,San Diego Fire-Rescue Department Station 22,fire_station
82,"500 Lomas Santa Fe Drive, Solana Beach",32.9952069,-117.2665689,1,Solana Beach Fire Department,fire_station
83,"1410 Brandywine Avenue, Chula Vista",32.6101388,-117.0288093,1,Chula Vista Fire Department Station 3,fire_station
84,"944 Cesar E. Chavez Parkway, San Diego",32.700977,-117.1450093,1,San Diego Fire-Rescue Department Station 7,fire_station
85,"1590 La Media Road, San Diego",32.5688324,-116.9627707,1,San Diego Fire-Rescue Department Station 43,fire_station
86,"4711 Voltaire Street, San Diego",32.7487503,-117.2418009,1,San Diego Fire-Rescue Department Station 15,fire_station
87,"Veracruz, Manuelparedes II, Tijuana",32.50909599999999,-117.066503,1,TIJUANA Fire Brigade B.C. Season 7,fire_station
88,"2870 Main Street, San Diego",32.6930956,-117.1323086,1,Global Fire & Safety,fire_station
89,La Mesa,32.76782869999999,-117.0230839,1,Us Fish & Wildlife Fire Management,fire_station
90,"16936 El Fuego, Rancho Santa Fe",33.0199013,-117.2073546,1,Rancho Santa Fe Fire Protection District Station 1,fire_station
91,"1811 Suncrest Boulevard, El Cajon",32.8070225,-116.8638975,1,San Miguel Fire District Station 18,fire_station
92,"1222 1st Avenue, San Diego",32.7181481,-117.1642239,1,City Disaster Preparedness Office,fire_station
93,"33 Saufley Street, San Diego",32.710241,-117.1934963,1,Federal Fire San Diego Station 12,fire_station
94,"614 Belleau Woods Avenue, San Diego",32.7427709,-117.1915885,1,Federal Fire San Diego Station 19,fire_station
95,San Diego,32.68404750000001,-117.1264126,1,Federal Fire San Diego Station 16,fire_station
96,"3657 Norman Scott Road, San Diego",32.6851588,-117.118141,1,Federal Fire San Diego Station 17,fire_station
97,San Diego,32.6835291,-117.237167,1,Federal Fire San Diego Station 111,fire_station
98,"9366 Friars Road, San Diego",32.7864695,-117.1241753,1,San Diego Fire-Rescue Department Station 45,fire_station
99,"6135 Imperial Avenue, San Diego",32.70895119999999,-117.066446,1,San Diego Fire-Rescue Department Squad 55,fire_station
100,"4605 62nd Street, San Diego",32.7608714,-117.0636231,1,San Diego Fire-Rescue Department Station 10,fire_station
101,"101 Grand Caribe Causeway, Coronado",32.62270580000001,-117.1348856,1,Coronado Fire Department Station 2,fire_station
102,"3880 Kearny Villa Road, San Diego",32.8123629,-117.1507623,1,San Diego Fire-Rescue Department Station 28,fire_station
103,"7180 Skyline Drive, San Diego",32.70352210000001,-117.0434116,1,San Diego Fire-Rescue Department Station 51,fire_station
104,San Diego,32.8250767,-117.2029363,1,Childress Fire Investigations,fire_station
105,"2110 Via Casa Alta, La Jolla",32.8392662,-117.2503736,1,San Diego Fire-Rescue Department Station 16,fire_station
106,"9110 Grossmont Boulevard, La Mesa",32.7736019,-117.001292,1,La Mesa Fire Department Station 13,fire_station
107,"8844 Dallas Street, La Mesa",32.7915855,-117.0055699,1,La Mesa Fire Department Station 12,fire_station
108,"14008 Interstate 8 Business Loop, El Cajon",32.8442118,-116.8845007,1,Lakeside Fire Station 3,fire_station
109,"10105 Vivera Drive, La Mesa",32.76984249999999,-116.9800656,1,San Miguel Fire District Station 21,fire_station
110,"695 Tyrone Street, El Cajon",32.803104,-116.9929407,1,Fire Station 7,fire_station
111,El Cajon,32.803284,-116.992511,1,Station 7,fire_station
112,"605 Mount Miguel Road, Chula Vista",32.65997469999999,-116.9710104,1,Chula Vista Fire Department Station 6,fire_station
113,"1301 North Marshall Avenue, El Cajon",32.81362310000001,-116.9753865,1,El Cajon Fire Department Station 9,fire_station
114,"11501 Via Rancho San Diego, El Cajon",32.7482508,-116.9289692,1,San Miguel Fire District Station 22,fire_station
115,"315 4th Avenue, Chula Vista",32.63996449999999,-117.0836802,1,City of Chula Vista Police Department,police
116,"3350 La Jolla Village Drive, San Diego",32.8750749,-117.2321714,1,Police & Security,police
117,"3240 Main Street, Lemon Grove",32.740527,-117.031609,1,San Diego County Sheriff's Department Lemon Grove Substation,"police, local_government_office"
118,"10440 Black Mountain Road, San Diego",32.9061639,-117.1191938,1,San Diego Regional Public Safety Training Institute,police
119,"315 4th Avenue, Chula Vista",32.6399421,-117.0826832,1,Chula Vista Police-Juvenile,police
120,"315 4th Avenue, Chula Vista",32.6399925,-117.0827967,1,Chula Vista Police Department-Drugs,police
121,"5348 University Avenue #100, San Diego",32.7494215,-117.081145,1,San Diego Police Department Multi-Cultural Community Relations,"police, local_government_office"
122,"4310 Landis Street, San Diego",32.7467283,-117.1014417,1,San Diego Police Department Mid-City Division,police
123,"9225 Aero Drive, San Diego",32.8094321,-117.1289725,1,San Diego Police Department Eastern Division,police
124,"1409 Fourth Avenue, San Diego",32.7202284,-117.1610201,1,San Diego County Sheriff's Department,"police, local_government_office"
125,"551 South 35th Street, San Diego",32.7002141,-117.1185413,1,Correctional Alternatives Inc,"police, local_government_office"
126,"250 East Main Street, El Cajon",32.7968083,-116.9590708,1,San Diego County Sheriff's Department El Cajon Civil Division,"police, local_government_office"
127,"182 Santar Place, San Marcos",33.1418785,-117.1466126,1,San Diego County Sheriff's Department,"police, local_government_office"
128,"100 Civic Center Way, El Cajon",32.7968556,-116.9604268,1,El Cajon Police Department,police
129,"500 3rd Avenue, Chula Vista",32.6327466,-117.0777261,1,South Bay Detention Facility,"police, local_government_office"
130,"201 North Broadway, Escondido",33.1227533,-117.0831068,1,Citizens Patrol Escondido,"local_government_office, police"
131,"8085 University Avenue, La Mesa",32.7670261,-117.0231207,1,La Mesa Police Department,police
132,"4100 Normal Street, San Diego",32.75504649999999,-117.1481013,1,San Diego School Police Department,police
133,"2560 Orion Way, Carlsbad",33.13784789999999,-117.2652844,1,Carlsbad Police Department,"police, local_government_office"
134,"1163 Centre City Parkway, Escondido",33.1356723,-117.0938069,1,Escondido Police Department,police
135,"175 North El Camino Real, Encinitas",33.0494238,-117.2585459,1,San Diego County Sheriff's Department North Coastal Station,"police, local_government_office"
136,"950 Marina Way, Chula Vista",32.6208499,-117.1031252,1,San Diego Harbor Police Chula Vista/South Bay Substation,police
137,San Diego,32.7160398,-117.1490943,1,SDCCD Police,police
138,"3380 North Harbor Drive, San Diego",32.7285483,-117.194138,1,San Diego Harbor Police Department,police
139,"5215 Gaines Street, San Diego",32.76410759999999,-117.1945054,1,San Diego Police Department Western Division,police
140,"1536 Frazee Road, San Diego",32.774002,-117.159923,1,San Diego Community College Police,police
141,"1000 Bay Marina Drive, National City",32.658481,-117.1126297,1,San Diego Dispatch,police
142,"9265 Aero Drive, San Diego",32.8092644,-117.1269808,1,San Diego Police Department Traffic Division,police
143,"7222 Skyline Drive, San Diego",32.70391650000001,-117.0425614,1,San Diego Police Department,police
144,"Kiowa Drive, La Mesa",32.7780457,-117.0405272,1,"Rangers, San Diego Water Department",police
145,"2 Greenhouse Lane, La Jolla",32.8826508,-117.2296864,1,UC San Diego Police Department,police
146,"11486 Campo Road, Spring Valley",32.7402529,-116.9472791,1,San Diego County Sheriff's Department Rancho San Diego Station,"police, local_government_office"
147,"8450 Mira Mesa Boulevard, San Diego",32.9131901,-117.1415653,1,San Diego Police Department RSVP Station,police
148,"Calle Alamo, Ciudad Jardin, Tijuana",32.514168,-117.062551,1,Police station Ciudad Jardin,police
149,"Calle Vicente Suárez, Hidalgo, Tijuana",32.5158829,-117.044524,1,Secretaría de Seguridad Pública Caseta de Policia Hidalgo,police
150,"Altabrisa, Tijuana",32.52982800000001,-116.9789114,1,Policia Municipal (Otay),police
151,"12365 Parkside Street, Lakeside",32.8579037,-116.9234555,1,San Diego County Sheriff's Department Lakeside Substation,"police, local_government_office"
152,"Avenida Flores Magón, Pedregalde Santa Julia, Tijuana",32.483292,-117.065033,1,SUBDELEGACIÓN SALVATIERRA,"police, local_government_office"
153,"Boulevard Alberto Limón Padilla, Ciudad Industrial, Tijuana",32.53730520000001,-116.9221572,1,POLICíA MUNICIPAL Distrito IX Centenario,police
154,"Calle 1 Norte 1125, Ciudad Industrial, Tijuana",32.5417886,-116.9127481,1,Police Directorate and Municipal Transit,police
155,"Boulevard Las Huertas, Huertas 1ra Sección, Tijuana",32.4864759,-116.950018,1,AYUNTAMIENTO DE TIJUANA SSPM,police
156,"10282 Rancho Bernardo Road, San Diego",33.02138779999999,-117.1189798,1,San Diego County Sheriff's Department,"police, local_government_office"
157,"Carretera Antigua a, Calle Tecate n, Presa Rodriguez, Tijuana",32.447869,-116.909639,1,Policía Municipal de Tijuana A.C. Los Pinos,police
158,"175 North El Camino Real, Encinitas",33.0493802,-117.2585638,1,Solana Beach Police Department,police
159,"2751 Alpine Boulevard, Alpine",32.8341517,-116.7541444,1,San Diego County Sheriff's Department Alpine Station,"police, local_government_office"
160,"5555 Overland Avenue # 19, San Diego",32.8346704,-117.133237,1,San Diego County Sheriff's Department Communication Center,"police, local_government_office"
161,"2501 Imperial Avenue, San Diego",32.7060726,-117.1398634,1,San Diego Police Department Central Division,police
162,"13100 Bowron Road, Poway",32.9553544,-117.0465333,1,San Diego County Sheriff's Department,"police, local_government_office"
163,"1120 27th Street, San Diego",32.5760578,-117.0759949,1,San Diego Police Department,police
164,"4275 Eastgate Mall, La Jolla",32.8768766,-117.2156345,1,San Diego Police Department Northern Division,police
165,"8811 Cuyamaca Street, Santee",32.8364561,-116.9834036,1,San Diego County Sheriff's Department,"police, local_government_office"
166,"772 Jamacha Road, El Cajon",32.7860185,-116.9279253,1,"Mo Parga Horse Training, Inc.",police
167,"700 Orange Avenue, Coronado",32.6898383,-117.1781368,1,Coronado Police Department,police
168,"Campus Way, San Marcos",33.1341738,-117.1543263,1,CSUSM Police,police
169,"182 Santar Place, San Marcos",33.14197579999999,-117.1466452,1,Palomar College Police Academy,police
170,"4439 Olney Street, San Diego",32.8012417,-117.2292718,1,SDPD Community Relations,police
171,"201 North Broadway, Escondido",33.1227665,-117.083183,1,Escondido City Hall,"city_hall, local_government_office"
172,"8130 Allison Avenue, La Mesa",32.7665226,-117.0227076,1,La Mesa City Hall,"city_hall, local_government_office"
173,"Civic Center Plaza, San Diego",32.7170716,-117.1625574,1,City of San Diego,"city_hall, local_government_office"
174,"202 C Street, San Diego",32.7169424,-117.1626309,1,San Diego City Hall,"city_hall, local_government_office"
175,"1200 Third Avenue, San Diego",32.71792540000001,-117.1626251,1,Civic Center Plaza,"city_hall, local_government_office"
176,"1243 National City Boulevard, National City",32.6721458,-117.1048483,1,National City,"city_hall, local_government_office"
177,"10601 North Magnolia Avenue, Santee",32.87050499999999,-116.969925,1,The City of Santee,"city_hall, local_government_office"
178,San Diego,32.94874979999999,-117.2339935,1,Carmel Valley Community Center,"city_hall, local_government_office"
179,"Blvd. Insurgentes # 1760-8, Los Alamos, Tijuana",32.5035216,-116.9447694,1,TIJUANA CITY COUNCIL DIF,"city_hall, local_government_office"
180,"1050 Camino Del Mar, Del Mar",32.9551705,-117.2639834,1,Del Mar City Hall,"city_hall, local_government_office"
181,"825 Imperial Beach Boulevard, Imperial Beach",32.5762965,-117.1161238,1,Imperial Beach Civic Center,"city_hall, local_government_office"
182,"505 South Vulcan Avenue, Encinitas",33.0455242,-117.2914512,1,Encinitas City Hall,"city_hall, local_government_office"
183,"276 4th Avenue, Chula Vista",32.64050439999999,-117.0846946,1,City of Chula Vista - City Hall,"city_hall, local_government_office"
184,"1827 India Street, San Diego",32.7240498,-117.1682977,1,Little Italia San Diego C.A,"city_hall, local_government_office"
185,"825 Imperial Beach Boulevard, Imperial Beach",32.5762965,-117.1161237,1,City of Imperial Beach,"city_hall, local_government_office"
186,"825 Imperial Beach Boulevard, Imperial Beach",32.5762536,-117.1162391,1,City Hall- ImperiaL Beach,"city_hall, local_government_office"
187,"8602 Garde Court, San Diego",32.9185709,-117.1381688,1,City of Mira Mesa,"city_hall, local_government_office"
188,"Libertad, Tijuana",32.532708,-117.013702,1,Señalamiento Vial DSPM Tijuana,"city_hall, local_government_office"
189,"Boulevard Cuauhtemoc Sur Oriente 2, Revolucion, Tijuana",32.5208905,-117.0213414,1,Secretaria de Salud,"city_hall, local_government_office"
190,"13325 Civic Center Drive, Poway",32.9540463,-117.042563,1,Poway City Hall,"city_hall, local_government_office"
191,"Cedro 10108, Valle del Sur, Tijuana",32.473674,-117.0275613,1,Centro de transferencia,"city_hall, local_government_office"
192,"635 Highway 101, Solana Beach",32.983648,-117.2700004,1,City Hall of Solana Beach,"city_hall, local_government_office"
193,"Calle José Haros Aguilar 2000, Fracc. Villa Turistica, Rosarito",32.3636548,-117.0544204,1,Palacio Municipal Playas de Rosarito,"city_hall, local_government_office"
194,"Playas Rosarito, Rosarito",32.363597,-117.054287,1,SECRETARY OF FINANCE,"city_hall, local_government_office"
195,"5045 Shoreham Place, San Diego",32.8518281,-117.1846778,1,US Post Office - Pickup & Dropoff Only,"post_office, finance"
196,"16960 Bernardo Center Drive, San Diego",33.02151139999999,-117.0751346,1,United States Postal Service,"post_office, finance"
197,"11251 Rancho Carmel Drive, San Diego",32.983975,-117.081188,1,United States Postal Service,"post_office, finance"
198,"34800 Bob Wilson Drive, San Diego",32.7288371,-117.1455495,1,United States Postal Service,"post_office, finance"
199,"750 3rd Avenue, Chula Vista",32.625457,-117.0746346,1,United States Postal Service,"post_office, finance"
200,"4740 Mission Gorge Place, San Diego",32.78202339999999,-117.0909949,1,United States Postal Service,"post_office, finance"
201,"5073 Central Avenue, Bonita",32.66962420000001,-117.0210564,1,United States Postal Service,"post_office, finance"
202,"8690 Aero Drive # 115, San Diego",32.810305,-117.1408183,1,Aero Mail,"post_office, finance, store"
203,"867 North 2nd Street, El Cajon",32.80684259999999,-116.9353062,1,United States Postal Service,"post_office, finance"
204,"11251 Rancho Carmel Drive, San Diego",32.9838551,-117.0807624,1,Margaret L. Sellers Processing and Distribution Center,"post_office, finance, storage"
205,"2960 Fern Avenue, San Diego",32.5742996,-117.0693868,1,United States Postal Service,"post_office, finance"
206,"2493 Roll Drive #210, San Diego",32.5535487,-116.9364795,1,Correo Internacional,"post_office, finance"
207,"1150 Garden View Road, Encinitas",33.0582796,-117.2644427,1,United States Postal Service,"post_office, finance, local_government_office"
208,"Plaza Ejecutiva Carrusel, Boulevard Federico Benítez López 14785, Gas y Anexas, Tijuana",32.4991371,-116.957678,1,Estafeta La Mesa,"post_office, finance"
209,"10807 Vista Sorrento Parkway, San Diego",32.9041526,-117.2223209,1,United States Postal Service,"post_office, finance"
210,"4492 Camino De La Plaza, San Ysidro",32.5455925,-117.0375255,1,San Ysidro Postal Center,"post_office, finance"
211,"3426 College Avenue, San Diego",32.7419621,-117.0562363,1,United States Postal Service,"post_office, finance, local_government_office"
212,"6519 Bisby Lake Avenue, San Diego",32.8005391,-117.0134309,1,United States Postal Service,"post_office, finance"
213,"5344 Jackson Drive, La Mesa",32.7761623,-117.0169765,1,United States Postal Service,"post_office, finance"
214,"Lázaro Cárdenas 1000, Rivero Alamard, Tijuana",32.5293345,-117.0861223,1,Telegrafos Conm Central Camionera,"post_office, finance"
